Trip,Ident,Species,Coord_system,Latitude,Longitude,Date,Altitude_m,Collectors,Seeds,Location,Comments,MaxCoordUncertainty_m,Trip_comments,,,,,,,,,,,,,,,,
Trip11,NSW0325,Eucalyptus melliodora,WGS84,-35.10194927,149.329333,04-OCT-19 12:38:42PM,686.742188,Helen Bothwell & Margaret Mackinnon,Y,E on Bullinah Cres.,"Lots of good plump 5-valved fruits;  good leaves, bark and axial inflor. ",,,,,,,,,,,,,,,,,,
Trip11,NSW0326,Eucalyptus melliodora,WGS84,-35.01737678,149.2853682,04-OCT-19 1:38:04PM,611.76001,Helen Bothwell & Margaret Mackinnon,F,"E down Rosamel St from Gundaroo, by McLeods Creek Nature Reserve","Just a few good fruits, perfect leaves and bark",,,,,,,,,,,,,,,,,,
Trip11,NSW0327,Eucalyptus melliodora,WGS84,-35.01632812,149.3023426,04-OCT-19 1:50:55PM,671.121094,Helen Bothwell & Margaret Mackinnon,F,Continuing down Rosamel,"Big old Emel, axial inflor, only 1 fruit",,,,,,,,,,,,,,,,,,
Trip11,NSW0328,Eucalyptus melliodora,WGS84,-35.01949363,149.3409415,04-OCT-19 2:10:02PM,755.956543,Helen Bothwell & Margaret Mackinnon,Y,Continuing down Rosamel,"Big old Emel, axial inflor, lots of 5-valved fruits but quite large and dark; lots of peppermint around (broad-leaved dives or robertsonia??); hybrid?",,,,,,,,,,,,,,,,,,
Trip11,NSW0329,Broad-leaved peppermint (dives or robertsonia?),WGS84,-35.0194907,149.3408977,04-OCT-19 2:11:09PM,756.677734,Helen Bothwell & Margaret Mackinnon,Y,Continuing down Rosamel,"Lots of large round fruits, convex, 3-valved",,,,,,,,,,,,,,,,,,
Trip11,NSW0330,Eucalyptus melliodora,WGS84,-34.93872109,149.2429615,04-OCT-19 2:41:25PM,635.312256,Helen Bothwell & Margaret Mackinnon,Y,N on Gundaroo Rd,"Lots of good 5-valved fruits, axial inflor.",,,,,,,,,,,,,,,,,,
Trip11,NSW0331,Eucalyptus melliodora,WGS84,-34.83341178,149.2424128,04-OCT-19 3:01:22PM,625.698975,Helen Bothwell & Margaret Mackinnon,N,N on Gundaroo Rd,"Big old tree, no fruit, good bark and axial inflor.",,,,,,,,,,,,,,,,,,
Trip11,NSW0332,Eucalyptus melliodora,WGS84,-34.77208793,149.2361568,04-OCT-19 3:44:12PM,637.955811,Helen Bothwell & Margaret Mackinnon,Y,W on Dalton Rd,"Big old perfect Emel, ~10 fruits",,,,,,,,,,,,,,,,,,
Trip11,NSW0333,Eucalyptus melliodora,WGS84,-34.76239661,149.2120114,04-OCT-19 3:53:34PM,637.955811,Helen Bothwell & Margaret Mackinnon,Y,W on Dalton Rd,"Good old Emel, good fruits and axial inflor.",,,,,,,,,,,,,,,,,,
Trip11,NSW0334,Eucalyptus melliodora,WGS84,-34.7289104,149.187526,04-OCT-19 4:04:47PM,553.841064,Helen Bothwell & Margaret Mackinnon,Y,W on Dalton Rd,"Good old Emel, good fruits and axial inflor.",,,,,,,,,,,,,,,,,,
Trip11,NSW0335,Eucalyptus melliodora,WGS84,-34.68912528,149.0604294,04-OCT-19 4:27:57PM,607.914795,Helen Bothwell & Margaret Mackinnon,Y,W on Dalton Rd,"Big old Emel, lots of good fruit, just coming out of higher elevation zone, lots of peppermint around here",,,,,,,,,,,,,,,,,,
Trip12,NSW0336,Eucalyptus melliodora,WGS84,-29.66700926,151.0560641,10-OCT-19 10:35:48AM,613.922852,Helen Bothwell,Y,Yetman Rd N from Inverell,"Good Emel, TONS of plump 5-valved fruits (ALAM10866)","Heading W from Byron Bay; ALAM2969, ALAM2970, & ALAM2971 nowhere to be found; SUP18 is NOT Emel (none of M. Supple's marked trees around here are Emel); ALAM2962 & ALAM11078 NOT Emel (in mountainous habitat, surrounded by stringybarks, peppermints, white gums, all v. tall and straight - not Emel habitat); ALAM9248 is only tree around and CLEARLY NOT Emel - deeply furrowed bark like Esid but light gray; ALA Emel S of Tenterfield in road construction area and/or burned. Basically, all 'Emel' I checked N of Tenterfield area are either absent or NOT ID'd correctly. Not worth checking up to Towoomba area. Terrible bush fires, with dense smoke blanketing the area from Lismore W. Was going to stay in Tenterfield, but air quality so poor, I drove W until the air was clear. Revising collection plan to start around Inverell instead.",,,,,,,,,,,,,,,,,
Trip12,NSW0337,Eucalyptus melliodora,WGS84,-29.60853978,151.0264281,10-OCT-19 11:00:10AM,640.8396,Helen Bothwell,N,Yetman Rd N from Inverell,"Big old Emel, leaves only, good 7 axial inflor; nurse to Brachychiton",,,,,,,,,,,,,,,,,,
Trip12,NSW0338,Eucalyptus melliodora,WGS84,-29.56623179,151.0037511,10-OCT-19 11:13:11AM,649.731689,Helen Bothwell,F,Yetman Rd N from Inverell,"Younger to mid-aged Emel, only 2 good plump fruits, 7 axial inflor; Brachychiton nurse",,,,,,,,,,,,,,,,,,
Trip12,NSW0339,Eucalyptus melliodora,WGS84,-29.520305,150.9939254,10-OCT-19 11:32:44AM,664.872559,Helen Bothwell,F,Yetman Rd N from Inverell,"Only 1 good plump 5-valved fruit, just done flowering, 7 axial inflor",,,,,,,,,,,,,,,,,,
Trip12,NSW0340,Eucalyptus melliodora,WGS84,-29.50308354,150.9730185,10-OCT-19 11:40:24AM,607.434082,Helen Bothwell,Y,Yetman Rd N from Inverell,"Leaves a bit larger, greener, but typical Emel 5-valved fruits, bark 7 axial inflor., just done flowering",,,,,,,,,,,,,,,,,,
Trip12,NSW0341,Eucalyptus albens,WGS84,-29.49257162,150.9562456,10-OCT-19 11:50:23AM,612.721436,Helen Bothwell,F,Yetman Rd N from Inverell,"Lots of glaucous tubular fruits, but just done flowering so green/immature",,,,,,,,,,,,,,,,,,
Trip12,NSW0342,Eucalyptus melliodora,WGS84,-29.47903049,150.9349163,10-OCT-19 12:04:06PM,607.434082,Helen Bothwell,Y,,"Lots of fruits, plump, many 4-valved some 5, good gray-green leaves, 7 axial inflor",,,,,,,,,,,,,,,,,,
Trip12,NSW0343,Eucalyptus melliodora,WGS84,-29.3854903,150.9096203,10-OCT-19 12:29:44PM,547.592529,Helen Bothwell,Y,,"Youngish Emel next to big tall Emel, only ~10 fruits",,,,,,,,,,,,,,,,,,
Trip12,NSW0344,Eucalyptus melliodora,WGS84,-29.36829784,150.9126307,10-OCT-19 12:44:02PM,525.482422,Helen Bothwell,Y,,"LOADED w flowers, bees, tons of fruits, but very green/immature",,,,,,,,,,,,,,,,,,
Trip12,NSW0345,Eucalyptus melliodora (hyb?),WGS84,-29.26142589,150.8987213,10-OCT-19 1:11:12PM,422.141357,Helen Bothwell,Y,,"Hybrid? Fruits more barrel-shaped, leaves greener, thinner, frondy",,,,,,,,,,,,,,,,,,
Trip12,NSW0346,Eucalyptus melliodora,WGS84,-29.24407921,150.8960443,10-OCT-19 1:35:16PM,420.459106,Helen Bothwell,Y,,"Good Emel, TONS of plump 5-valved fruits, loaded w flowers, bees, 7 axial inflor",,,,,,,,,,,,,,,,,,
Trip12,NSW0347,Eucalyptus melliodora,WGS84,-29.53112084,150.5629587,10-OCT-19 2:43:47PM,336.344482,Helen Bothwell,Y,"S to Warialda, W on High St to Mosquito Creek Rd","Good Emel, TONS of nice plump 5-valved fruits, 7 axial inflor, leaves pretty sparse - v dry out here",,,,,,,,,,,,,,,,,,
Trip12,NSW0348,Eucalyptus melliodora,WGS84,-29.54613517,150.5540104,10-OCT-19 2:54:28PM,319.761841,Helen Bothwell,Y,"S towards Bingara, at rest area on W side of rd",TONS of fruits,,,,,,,,,,,,,,,,,,
Trip12,NSW0349,Eucalyptus melliodora,WGS84,-29.56176172,150.5434104,10-OCT-19 3:08:58PM,325.289307,Helen Bothwell,Y,S towards Bingara on B95,"TONS of good Emel fruit, 1 flower, just done flowering",,,,,,,,,,,,,,,,,,
Trip12,NSW0350,Eucalyptus melliodora,WGS84,-29.80885059,150.5384376,10-OCT-19 3:37:31PM,295.96936,Helen Bothwell,F,S on B95,"Big old tree, could only reach 3 fruits, fruits grayish rather than more common greenish tinged red/pink",,,,,,,,,,,,,,,,,,
Trip12,NSW0351,Eucalyptus melliodora ?,WGS84,-29.91123662,150.6336754,10-OCT-19 4:06:40PM,305.101807,Helen Bothwell,Y,E out of Bingara on Copeton Dam Rd,"Big old tree, fruits v large, grayer than the normal greener tint",,,,,,,,,,,,,,,,,,
Trip12,NSW0352,Eucalyptus melliodora,WGS84,-29.9495058,150.7221029,10-OCT-19 4:34:12PM,313.993896,Helen Bothwell,F,Copeton Dam Rd,Few fruits,,,,,,,,,,,,,,,,,,
Trip12,NSW0353,Eucalyptus melliodora,WGS84,-29.96333334,150.7334615,10-OCT-19 4:43:10PM,316.156982,Helen Bothwell,F,Copeton Dam Rd,Few fruits,,,,,,,,,,,,,,,,,,
Trip12,NSW0354,Eucalyptus melliodora,WGS84,-29.99635426,150.8152035,10-OCT-19 5:00:19PM,332.018555,Helen Bothwell,N,Copeton Dam Rd,"Big old Emel, leaves only, but bark and leaves perfect",,,,,,,,,,,,,,,,,,
Trip12,NSW0355,Eucalyptus sideroxylon,WGS84,-29.86738024,150.9031814,10-OCT-19 5:31:30PM,694.192627,Helen Bothwell,F,Copeton Dam Rd,"Older Esid! Many pink flowers, only 1 mature fruit; in clump by a fence and many across rd, pink not common, perhaps planted and spread??",,,,,,,,,,,,,,,,,,
Trip12,NSW0356,Eucalyptus sideroxylon,WGS84,-29.85969194,150.8983499,10-OCT-19 5:39:50PM,698.278076,Helen Bothwell,Y,Copeton Dam Rd,Lots of fruit,,,,,,,,,,,,,,,,,,
Trip12,NSW0357,Eucalyptus sideroxylon,WGS84,-29.84141068,150.8883544,10-OCT-19 5:51:01PM,694.913574,Helen Bothwell,Y,Copeton Dam Rd,"Lots of fruit, along fence, possibly planted, but many Esid in area",,,,,,,,,,,,,,,,,,
Trip12,NSW0358,Eucalyptus sideroxylon,WGS84,-29.81534866,150.9138883,10-OCT-19 6:02:18PM,683.137207,Helen Bothwell,Y,Copeton Dam Rd,"White flowers, plenty of fruit",,,,,,,,,,,,,,,,,,
Trip12,NSW0359,Eucalyptus sideroxylon,WGS84,-29.80145079,150.9211789,10-OCT-19 6:09:45PM,655.259277,Helen Bothwell,Y,Copeton Dam Rd,Lots of fruit,,,,,,,,,,,,,,,,,,
Trip12,NSW0360,Eucalyptus melliodora,WGS84,-29.78798241,150.9468755,10-OCT-19 6:20:34PM,653.576904,Helen Bothwell,Y,Copeton Dam Rd,"Lots of fruit, big tree, architecture seems rather straight for Emel",E. albens v common around this region,,,,,,,,,,,,,,,,,
Trip12,NSW0361,Eucalyptus sideroxylon,WGS84,-29.98876344,151.1105486,11-OCT-19 11:15:02AM,830.458252,Helen Bothwell,Y,"S of Inverell on Thunderbolts Way to Bundara; older fire through here, maybe last year or year before that? Lots of epicormic resprout",Some fruits,,,,,,,,,,,,,,,,,,
Trip12,NSW0362,Eucalyptus melliodora,WGS84,-30.02303906,151.103305,11-OCT-19 11:37:38AM,780.469971,Helen Bothwell,Y,S of Inverell on Thunderbolts Way to Bundara,Fruits,,,,,,,,,,,,,,,,,,
Trip12,NSW0363,Eucalyptus melliodora,WGS84,-30.10237821,151.0891862,11-OCT-19 11:55:37AM,677.12915,Helen Bothwell,N,S of Inverell on Thunderbolts Way,"Leaves only, axial and terminal inflor, just finishing flowering",,,,,,,,,,,,,,,,,,
Trip12,NSW0364,Eucalyptus sideroxylon,WGS84,-30.14525173,151.0761101,11-OCT-19 12:04:23PM,693.47168,Helen Bothwell,Y,S of Inverell on Thunderbolts Way,"TONS of fruits, just finishing flowering",,,,,,,,,,,,,,,,,,
Trip12,NSW0365,Eucalyptus melliodora,WGS84,-30.21748169,150.9452369,11-OCT-19 12:39:33PM,860.739746,Helen Bothwell,Y,Barraba Rd W from Bundarra,"Respout, big old tree, lots of fruit; in burn area",,,,,,,,,,,,,,,,,,
Trip12,NSW0366,Eucalyptus melliodora,WGS84,-30.21231903,150.8840251,11-OCT-19 12:59:14PM,809.549805,Helen Bothwell,N,Barraba Rd W from Bundarra,"Big old tree, could only reach resprout leaves; in burn area",,,,,,,,,,,,,,,,,,
Trip12,NSW0367,Eucalyptus sideroxylon,WGS84,-30.21489873,150.7828832,11-OCT-19 1:20:36PM,703.084717,Helen Bothwell,F,Barraba Rd W from Bundarra,"Just a few fruits, flowering, lots of new fruits but too immature/soft/green; in burn area",,,,,,,,,,,,,,,,,,
Trip12,NSW0368,Eucalyptus melliodora,WGS84,-30.21659522,150.7356497,11-OCT-19 1:35:38PM,631.947754,Helen Bothwell,N,Barraba Rd W from Bundarra,"Very tall Emel, perfect leaves and bark",,,,,,,,,,,,,,,,,,
Trip12,NSW0369,Eucalyptus sideroxylon,WGS84,-30.26379188,150.7287346,11-OCT-19 1:50:01PM,679.532471,Helen Bothwell,Y,Barraba Rd W from Bundarra,"Big old Esid, many fruits",,,,,,,,,,,,,,,,,,
Trip12,NSW0370,Eucalyptus sideroxylon,WGS84,-30.26340497,150.7291427,11-OCT-19 1:57:13PM,679.532471,Helen Bothwell,Y,Barraba Rd W from Bundarra,"Big old Esid, many fruits",,,,,,,,,,,,,,,,,,
Trip12,NSW0371,Eucalyptus melliodora,WGS84,-30.32249856,150.6953044,11-OCT-19 2:15:44PM,686.261475,Helen Bothwell,N,Barraba Rd W from Bundarra,"Younger Emel next to old grandaddy, leaves only",,,,,,,,,,,,,,,,,,
Trip12,NSW0372,Eucalyptus melliodora,WGS84,-30.38253562,150.750949,11-OCT-19 3:38:35PM,507.938354,Helen Bothwell,F,Bundarra-Barraba Rd towards Woodsreef,Just a few fruits,,,,,,,,,,,,,,,,,,
Trip12,NSW0373,Eucalyptus melliodora hyb?,WGS84,-30.34444213,150.7664235,11-OCT-19 3:52:52PM,548.794189,Helen Bothwell,Y,Bundarra-Barraba Rd towards Woodsreef,"Fruit more barrel than cup shaped, both axial and terminal inflor.",,,,,,,,,,,,,,,,,,
Trip12,NSW0374,Eucalyptus melliodora,WGS84,-30.29915655,150.7871889,11-OCT-19 4:12:41PM,544.708618,Helen Bothwell,Y,Bundarra-Barraba Rd towards Woodsreef,"Plenty of fruit, 4/5-valved",,,,,,,,,,,,,,,,,,
Trip12,NSW0375,Eucalyptus sideroxylon,WGS84,-30.29369935,150.7947231,11-OCT-19 4:26:55PM,566.0979,Helen Bothwell,F,Bundarra-Barraba Rd towards Woodsreef,Few fruit,,,,,,,,,,,,,,,,,,
Trip12,NSW0376,Eucalyptus sideroxylon,WGS84,-30.21560951,150.7006708,11-OCT-19 4:58:57PM,741.537109,Helen Bothwell,F,Bundarra-Barraba Rd towards Woodsreef,Few fruit,,,,,,,,,,,,,,,,,,
Trip12,NSW0377,Eucalyptus sideroxylon,WGS84,-30.1814981,150.6607832,11-OCT-19 5:14:56PM,737.211182,Helen Bothwell,Y,W on Gulf Creek Rd,Lots of fruit,,,,,,,,,,,,,,,,,,
Trip12,NSW0378,Eucalyptus melliodora,WGS84,-30.18187612,150.6538212,11-OCT-19 5:24:55PM,698.999023,Helen Bothwell,Y,W on Gulf Creek Rd,Some fruit,,,,,,,,,,,,,,,,,,
Trip12,NSW0379,Eucalyptus melliodora,WGS84,-29.80271428,150.6009026,11-OCT-19 6:24:45PM,303.179199,Helen Bothwell,Y,Delungara-Ashford Rd E from Bingara,Lots of fruits,,,,,,,,,,,,,,,,,,
Trip12,NSW0380,Eucalyptus melliodora,WGS84,-29.77251621,151.2015618,12-OCT-19 8:59:38AM,678.571045,Helen Bothwell,Y,E on B76 from Inverell,Many fruits,,,,,,,,,,,,,,,,,,
Trip12,NSW0381,Eucalyptus melliodora,WGS84,-29.76999435,151.2875728,12-OCT-19 9:14:19AM,676.167969,Helen Bothwell,Y,Woodstock Rd N,"Heavy w good Emel fruits, flowers, buzzing w lots of bees",,,,,,,,,,,,,,,,,,
Trip12,NSW0382,Eucalyptus melliodora,WGS84,-29.7473094,151.3204757,12-OCT-19 9:35:51AM,676.167969,Helen Bothwell,Y,Woodstock Rd N,"Some fruits, just finishing flowering",,,,,,,,,,,,,,,,,,
Trip12,NSW0383,Eucalyptus melliodora,WGS84,-29.70968245,151.3589871,12-OCT-19 9:51:37AM,783.834717,Helen Bothwell,Y,Woodstock Rd N,"Floweing, lots of fruits",,,,,,,,,,,,,,,,,,
Trip12,NSW0384,Eucalyptus melliodora,WGS84,-29.69943381,151.3493188,12-OCT-19 10:02:28AM,763.647217,Helen Bothwell,Y,Woodstock Rd N,"Done flowering, TONS of fruits",,,,,,,,,,,,,,,,,,
Trip12,NSW0385,Eucalyptus melliodora,WGS84,-29.65709128,151.3777101,12-OCT-19 10:27:37AM,845.358643,Helen Bothwell,Y,Kings Plains Rd,"Lots of fruits, in forest, smaller fruits, taller, straighter than field trees",,,,,,,,,,,,,,,,,,
Trip12,NSW0386,Eucalyptus melliodora,WGS84,-29.64316291,151.4238655,12-OCT-19 10:48:00AM,937.884766,Helen Bothwell,N,Kings Plains Rd,"V tall, leaves only",,,,,,,,,,,,,,,,,,
Trip12,NSW0387,Eucalyptus melliodora,WGS84,-29.64002171,151.5010308,12-OCT-19 11:06:14AM,1001.091064,Helen Bothwell,N,Kings Plains Rd,"Leaves only, v tall in forest",,,,,,,,,,,,,,,,,,
Trip12,NSW0388,Eucalyptus melliodora,WGS84,-29.63967579,151.5310326,12-OCT-19 11:16:11AM,953.265869,Helen Bothwell,N,Kings Plains Rd,"V Tall, resprout only","Beautiful forest through here! Kings Plains Nat'l Park surrounding, yellow box heaven.",,,,,,,,,,,,,,,,,
Trip12,NSW0389,Eucalyptus melliodora hyb?,WGS84,-29.59563877,151.5696594,12-OCT-19 11:32:16AM,891.020996,Helen Bothwell,Y,Strathbogie Rd W,"Juv leaves gray-green ovate, but mature leaves much darker than typical Emel, TONS of 4/5 fruits",,,,,,,,,,,,,,,,,,
Trip12,NSW0390,Eucalyptus melliodora,WGS84,-29.53579299,151.496711,12-OCT-19 11:58:18AM,822.767822,Helen Bothwell,N,Strathbogie Rd W,"V tall, leaves only",,,,,,,,,,,,,,,,,,
Trip12,NSW0391,Eucalyptus melliodora,WGS84,-29.51559068,151.4805206,12-OCT-19 12:08:50PM,822.046875,Helen Bothwell,Y,Strathbogie Rd W,Emel some fruit,,,,,,,,,,,,,,,,,,
Trip12,NSW0392,Eucalyptus melliodora,WGS84,-29.46364668,151.4856995,12-OCT-19 12:30:19PM,753.793701,Helen Bothwell,Y,Strathbogie Rd W,Lots of fruit,,,,,,,,,,,,,,,,,,
Trip12,NSW0393,Eucalyptus melliodora,WGS84,-29.4280355,151.7012858,12-OCT-19 1:16:58PM,876.841553,Helen Bothwell,F,E on Deepwater-Emmavale Rd,Just a few fruits,,,,,,,,,,,,,,,,,,
Trip12,NSW0394,Eucalyptus melliodora,WGS84,-29.51343359,151.8577896,12-OCT-19 2:50:35PM,1028.488281,Helen Bothwell,Y,S on A15,Some seed,"Checked ALA N of here - too high elevation and in Nat'l Park/Rec area, and further N group got burned",,,,,,,,,,,,,,,,,
Trip12,NSW0395,Eucalyptus melliodora,WGS84,-29.93339963,151.2450634,12-OCT-19 4:56:58PM,861.460693,Helen Bothwell,N,Guyra Rd,"V tall Emel, leaves only",,,,,,,,,,,,,,,,,,
Trip12,NSW0396,Eucalyptus melliodora,WGS84,-29.9558436,151.1197591,13-OCT-19 10:09:55AM,798.254395,Helen Bothwell,N,S towards Bundarra from Inverell,"Mid-aged Emel, big burn area here and N, resprout leaves only",,,,,,,,,,,,,,,,,,
Trip12,NSW0397,Eucalyptus melliodora,WGS84,-29.96361815,151.1199661,13-OCT-19 10:32:57AM,797.293213,Helen Bothwell,Y,S towards Bundarra from Inverell,Close to NSW0396 but has SEED,,,,,,,,,,,,,,,,,,
Trip12,NSW0398,Eucalyptus melliodora,WGS84,-30.00871866,151.104634,13-OCT-19 10:40:54AM,786.718506,Helen Bothwell,N,S towards Bundarra from Inverell,Leaves only,,,,,,,,,,,,,,,,,,
Trip12,NSW0399,Eucalyptus melliodora,WGS84,-30.17427416,151.0763469,13-OCT-19 11:11:20AM,654.778564,Helen Bothwell,Y,S side of Bundarra,Lots of fruits,,,,,,,,,,,,,,,,,,
Trip12,NSW0400,Eucalyptus melliodora,WGS84,-30.24713511,151.1393427,13-OCT-19 11:32:45AM,676.167969,Helen Bothwell,Y,,Many fruits,,,,,,,,,,,,,,,,,,
Trip12,NSW0401,Eucalyptus sideroxylon,WGS84,-30.26361535,151.1715356,13-OCT-19 12:09:46PM,699.239502,Helen Bothwell,F,,"Only 2 fruits, lots of Esid here but all v tall and no reachable fruits",,,,,,,,,,,,,,,,,,
Trip12,NSW0402,Eucalyptus sideroxylon,WGS84,-30.26444005,151.1739639,13-OCT-19 12:16:35PM,702.123291,Helen Bothwell,F,,Few fruits,,,,,,,,,,,,,,,,,,
Trip12,NSW0403,Eucalyptus sideroxylon,WGS84,-30.30901317,151.2070303,13-OCT-19 12:39:38PM,710.053955,Helen Bothwell,N,,Only dead dried fruits,,,,,,,,,,,,,,,,,,
Trip12,NSW0404,Eucalyptus melliodora,WGS84,-30.33818219,151.2148598,13-OCT-19 12:47:39PM,720.147705,Helen Bothwell,Y,Bundarra Rd to Armidale,Fruit,,,,,,,,,,,,,,,,,,
Trip12,NSW0405,Eucalyptus melliodora,WGS84,-30.47887319,151.3935311,13-OCT-19 1:50:31PM,798.494629,Helen Bothwell,?,Bundarra Rd to Armidale,,,,,,,,,,,,,,,,,,,
Trip12,NSW0406,Eucalyptus melliodora,WGS84,-30.49451348,151.4914718,13-OCT-19 2:08:52PM,904.239014,Helen Bothwell,N,Bundarra Rd to Armidale,Leaves only,,,,,,,,,,,,,,,,,,
Trip12,NSW0407,Eucalyptus melliodora,WGS84,-30.47438342,151.7405373,13-OCT-19 3:09:51PM,1020.076904,Helen Bothwell,N,Rockvale Rd NE out of Armidale,"Huge tall old Emel, leaves only, just finishing flowering, axial inflor.",,,,,,,,,,,,,,,,,,
Trip12,NSW0408,Eucalyptus melliodora hyb?,WGS84,-30.44934265,151.8083059,13-OCT-19 3:25:46PM,1006.378174,Helen Bothwell,Y,Rockvale Rd NE out of Armidale,"Not sure on this one, leaves tougher/greener, fruits larger but 5-valved, just seems a bit off, inflorescence also a bit longer little bit like Esid inflor; big-leaved seedling nearby (apple box?)",,,,,,,,,,,,,,,,,,
Trip12,NSW0409,Eucalyptus melliodora hyb?,WGS84,-30.44934827,151.842824,13-OCT-19 3:43:22PM,1058.289063,Helen Bothwell,Y,Rockvale Rd NE out of Armidale,"5-valved fruit but leaves again larger and tougher, with round-leaved seedling underneath (apple box??)",,,,,,,,,,,,,,,,,,
Trip12,NSW0410,Eucalyptus melliodora,WGS84,-30.54418716,151.7940752,13-OCT-19 5:02:16PM,966.243408,Helen Bothwell,N,At rest stop along B78,"Flowering, leaves only, but good 7 axial inflor.",,,,,,,,,,,,,,,,,,
Trip12,NSW0411,Eucalyptus melliodora ?,WGS84,-30.54290137,151.7729065,13-OCT-19 5:14:05PM,996.524902,Helen Bothwell,N,Continuing along B78,"Leaves only, bark looks good",,,,,,,,,,,,,,,,,,
Trip12,NSW0412,?,WGS84,-30.54499794,151.7411247,13-OCT-19 5:24:31PM,993.881104,Helen Bothwell,?,"S from Armidale, Thunderbolt Way S of Uralla, then Hillview Rd E",,,,,,,,,,,,,,,,,,,
Trip12,NSW0413,Eucalyptus melliodora ?,WGS84,-30.79278426,151.5622504,14-OCT-19 11:19:51AM,1071.987549,Helen Bothwell,Y,Along Hillview Rd,"Fruit s 5-valved but larger leaves ovate, more blue-gray than gray-green and tougher, axial flowers, tree looks in rough shape","Emel weird around Armidale - definitely at higher elevation end of their range, cooler",,,,,,,,,,,,,,,,,
Trip12,NSW0414,Eucalyptus melliodora,WGS84,-30.79483942,151.5664735,14-OCT-19 11:34:47AM,1082.562256,Helen Bothwell,N,Along Hillview Rd,"Close to NSW0413 but looks more Emel, leaves gray-green, axial fruits, leaves only, fruits few/green/immature",,,,,,,,,,,,,,,,,,
Trip12,NSW0415,Eucalyptus melliodora ?,WGS84,-30.8061995,151.5887713,14-OCT-19 11:45:03AM,1120.533936,Helen Bothwell,N,Along Hillview Rd,"Leaves darker green and tougher than Emel, but boxy yellow/gray bark, no accessible fruit",E. conica throughout here?,,,,,,,,,,,,,,,,,
Trip12,NSW0416,Eucalyptus melliodora ?,WGS84,-30.80228892,151.229694,14-OCT-19 12:48:24PM,869.87207,Helen Bothwell,N,Green Valley Rd,"No low branches, leaves and bark look good",Snow gums (?!) just N of here,,,,,,,,,,,,,,,,,
Trip12,NSW0417,Eucalyptus melliodora,WGS84,-30.80730155,151.1925294,14-OCT-19 1:06:20PM,797.052734,Helen Bothwell,N,Rocky Gully Rd W," Good Emel, axial inflor, but tall, leaves only",,,,,,,,,,,,,,,,,,
Trip12,NSW0418,Eucalyptus melliodora,WGS84,-30.7754836,151.1688817,14-OCT-19 1:28:46PM,852.568604,Helen Bothwell,F,Rocky Gully Rd W,"Younger Emel, just finishing flowering, just a couple good Emel fruits",,,,,,,,,,,,,,,,,,
Trip12,NSW0419,Eucalyptus melliodora,WGS84,-30.75740257,151.1615932,14-OCT-19 1:43:09PM,856.17334,Helen Bothwell,N,Rocky Gully Rd W,"Just finishing flowering, no fruit, but good axial inflor.",,,,,,,,,,,,,,,,,,
Trip12,NSW0420,Eucalyptus melliodora,WGS84,-30.74620368,151.1480821,14-OCT-19 1:48:44PM,834.543945,Helen Bothwell,F,Rocky Gully Rd W,"Just a couple fruits, good axial inflor, younger",,,,,,,,,,,,,,,,,,
Trip12,NSW0421,Eucalyptus melliodora,WGS84,-30.74259594,151.1421841,14-OCT-19 1:54:52PM,849.203857,Helen Bothwell,Y,Rocky Gully Rd W,"Mid-aged Emel, finally lots of fruit","Lots of white gums, stringybark, and peppermints around here",,,,,,,,,,,,,,,,,
Trip12,NSW0422,Eucalyptus melliodora,WGS84,-30.69893494,151.1016073,14-OCT-19 2:23:06PM,816.759521,Helen Bothwell,N,"S on Retreat Rd, W on Watsons Creek","Just 1 good fruit, axial inflor",,,,,,,,,,,,,,,,,,
Trip12,NSW0423,Eucalyptus melliodora,WGS84,-30.70820667,151.0719744,14-OCT-19 2:33:40PM,820.845215,Helen Bothwell,F,"S on Retreat Rd, W on Watsons Creek","Big older Emel, loaded w flowes and axial inflor, but only 3 good mature fruits",,,,,,,,,,,,,,,,,,
Trip12,NSW0424,Eucalyptus melliodora,WGS84,-30.71791652,151.007706,14-OCT-19 3:00:10PM,856.654053,Helen Bothwell,Y,Manilla Rd,"Big Emel, plenty of large fruit, axial inflor, just done flowering",,,,,,,,,,,,,,,,,,
Trip12,NSW0425,Eucalyptus melliodora,WGS84,-30.71857106,150.9780445,14-OCT-19 3:18:01PM,786.95874,Helen Bothwell,F,Manilla Rd,"Heavy w flowers, bees, but only a couple good mature Emel fruits, nurse to lots of Brachychiton",,,,,,,,,,,,,,,,,,
Trip12,NSW0426,Eucalyptus melliodora,WGS84,-30.73446474,150.8890866,14-OCT-19 3:49:33PM,433.677124,Helen Bothwell,N,Manilla Rd,"HUGE old Emel, no fruit, good 7-axial inflor",,,,,,,,,,,,,,,,,,
Trip12,NSW0427,Eucalyptus melliodora ??,WGS84,-30.80365241,150.7530722,14-OCT-19 4:25:40PM,434.157837,Helen Bothwell,Y,S towards Tamworth on B95,"Axial and terminal inflor., lots of fruits and white flowers, fruits quite small and barrel-shaped, 4/5-valved",,,,,,,,,,,,,,,,,,
Trip12,NSW0428,Ironbark ssp. ,WGS84,-32.4476763,150.269833,15-OCT-19 11:59:18AM,357.012573,Helen Bothwell,Y,"Tamworth heading S back home, S from Sandy Hollow on Byalong Way","NOT Esid, 4-valved tubelike fruits, terminal bright yellow clumped inflor, grayer-black bark w no red, large leaves",,,,,,,,,,,,,,,,,,
Trip12,NSW0429,Eucalyptus melliodora,WGS84,-32.71148371,150.0028898,15-OCT-19 1:06:54PM,652.13501,Helen Bothwell,F,Byalong Valley Way,"Just a few fruits, 4/5-valved and on small side, good 7-axial inflor",,,,,,,,,,,,,,,,,,
Trip12,NSW0430,Eucalyptus melliodora,WGS84,-32.74924845,149.9864985,15-OCT-19 1:20:07PM,614.884277,Helen Bothwell,F,Byalong Valley Way,"Just a few fruits, 4/5-valved and on small side, good 7-axial inflor",,,,,,,,,,,,,,,,,,
Trip12,NSW0431,Eucalyptus melliodora,WGS84,-33.56762814,149.7169738,15-OCT-19 4:17:38PM,752.592041,Helen Bothwell,Y,Beaconsfield Rd S of Bathurst,Fruits smaller,,,,,,,,,,,,,,,,,,
Trip12,NSW0432,Eucalyptus melliodora,WGS84,-33.54143025,149.7208211,15-OCT-19 4:27:24PM,724.233643,Helen Bothwell,N,Beaconsfield Rd S of Bathurst,"No fruit, 7-axial inflor v large","NSW0431 and 0432 seem a bit off, habit of leaves bunched together, but very windy area and higher elevation",,,,,,,,,,,,,,,,,
Trip12,NSW0433,Eucalyptus melliodora,WGS84,-33.55090759,149.6747766,15-OCT-19 4:43:01PM,786.718506,Helen Bothwell,F,O'Connel Plains Rd,"Few fruits 4/5-valved, 7-axial inflor",,,,,,,,,,,,,,,,,,
Trip12,NSW0434,Eucalyptus melliodora,WGS84,-33.51249928,149.5974329,15-OCT-19 5:02:46PM,789.843018,Helen Bothwell,F,Small side rd E,"Few fruits 4/5-valved but quite small cups, 7-axial inflor",,,,,,,,,,,,,,,,,,
Trip12,NSW0435,Eucalyptus melliodora,WGS84,-33.4907505,149.5847496,15-OCT-19 5:14:12PM,714.620361,Helen Bothwell,N,Lagood Rd,"Leaves only, axial inflor.",,,,,,,,,,,,,,,,,,
Trip12,NSW0436,Eucalyptus melliodora ??,WGS84,-33.62226466,149.1314044,15-OCT-19 6:07:25PM,730.481934,Helen Bothwell,Y,"S towards Cowra on A41, little drive pulloff to E","Emel? But everything a bit too big, leaves too big and thick, fruits 5-valved but disc quite recessed barrelly and big, flowering",,,,,,,,,,,,,,,,,,
Trip12,NSW0437,Eucalyptus melliodora,WGS84,-33.64004829,149.1013271,15-OCT-19 6:18:31PM,691.30835,Helen Bothwell,Y,At rest area E side,"LOTS of fruits & more normal Emel size, mostly 5-valved but some 6, flowering, 7 axial inflor.",,,,,,,,,,,,,,,,,,
Trip12,NSW0438,Eucalyptus melliodora,WGS84,-33.64965747,149.0052041,15-OCT-19 6:47:26PM,662.229004,Helen Bothwell,Y,Belubula Way,"Huge old Emel, loaded w fruits, flowers, bees",,,,,,,,,,,,,,,,,,
